Equities,WATERS CORP COM,16886,"£1,413,669",No,No,No,No,No
Equities,WEIR GROUP ORD GBP0.125,72006,"£1,224,102",No,No,No,No,No
Equities,WESFARMERS LTD NPV,0,£0,No,No,No,No,No
Equities,WEST JAPAN RAILWAY NPV,137100,"£4,853,175",No,No,No,No,No
Equities,WESTAR ENERGY INC COM,31755,"£828,475",No,No,No,No,No
Equities,WILLIS GROUP HOLDINGS COM USD0.000115 (NEW),254000,"£8,243,665",No,No,No,No,No
Equities,WIS ENERGY COM,144000,"£4,801,617",No,No,No,No,No
Equities,WM MORRISON SUPERMARKETS ORD GBP0.10,1966309,"£3,802,842",No,No,No,No,No
Equities,WOLSELEY ORD GBP0.108030303,39875,"£1,591,810",No,No,No,No,No
Equities,WOLTERS KLUWER EUR0.12,346906,"£7,615,932",No,No,No,No,No
Equities,WOOD GROUP (JOHN) ORD GBP0.0428571,220000,"£1,397,000",No,No,No,No,No
Equities,WOOLWORTHS HLDGS NPV,198527,"£950,330",No,No,No,No,No
Equities,WOOLWORTHS LTD NPV,581815,"£8,826,675",No,No,No,No,No
Equities,WPP PLC ORD GBP0.10,90795,"£1,390,071",No,No,No,No,No
Equities,XCEL ENERGY INC COM,294297,"£6,896,997",No,No,No,No,No
Equities,XEROX CORP COM,466200,"£4,041,761",No,No,No,No,No
Equities,XILINX INC COM,34651,"£986,894",No,No,No,No,No
Equities,YAHOO JAPAN CORP NPV,783500,"£2,178,484",No,No,No,No,No
Equities,YARA INTERNATIONAL NOK1.7,70107,"£2,402,584",No,No,No,No,No
Equities,YUM BRANDS INC COM,57137,"£3,029,858",No,No,No,No,No
Equities,ZILLOW GROUP INC COM USD0.0001,8011,"£541,046",No,No,No,No,No
Equities,ZIMMER HLDGS INC COM,27957,"£2,209,818",No,No,No,No,No
Equities,ZOOPLA PROPERTY GR ORD GBP0.001,560000,"£1,011,360",No,No,No,No,No
Equities,ZURICH INSURANCE GROUP AG CHF0.10,13614,"£3,109,166",No,No,No,No,No
